[
  {
    "id": "de.devops.git-github",
    "schemaVersion": 1,
    "contentVersion": "2026.09.1",
    "type": "concept",
    "domain": "data-engineering",
    "topic": "devops",
    "term": "Git / GitHub",
    "difficulty": "core",
    "priority": 90,
    "shortType": "concept",
    "definition": "Version control. Branching strategies, PR reviews, rebase, tagging, git hooks.",
    "prerequisites": [],
    "relatedConcepts": [],
    "nextConcepts": [],
    "quickPaths": [],
    "tags": [
      "devops"
    ],
    "sourceRefs": [
      {
        "source": "de_encyclopedia_2025.html",
        "section": "Git / GitHub",
        "sourceType": "primary"
      }
    ],
    "provenance": "source-derived",
    "authoringStatus": "stub"
  },
  {
    "id": "de.devops.terraform-state-management",
    "schemaVersion": 1,
    "contentVersion": "2026.09.1",
    "type": "concept",
    "domain": "data-engineering",
    "topic": "devops",
    "term": "Terraform state management",
    "difficulty": "core",
    "priority": 85,
    "shortType": "concept",
    "definition": "TODO: define Terraform state management.",
    "prerequisites": [],
    "relatedConcepts": [],
    "nextConcepts": [],
    "quickPaths": [],
    "tags": [
      "devops"
    ],
    "sourceRefs": [
      {
        "source": "de_encyclopedia_2025.html",
        "section": "Most Asked Concepts · DevOps/IaC",
        "sourceType": "primary"
      }
    ],
    "provenance": "inferred",
    "authoringStatus": "stub"
  },
  {
    "id": "de.devops.ci-cd-for-data-pipelines",
    "schemaVersion": 1,
    "contentVersion": "2026.09.1",
    "type": "concept",
    "domain": "data-engineering",
    "topic": "devops",
    "term": "CI/CD for data pipelines",
    "difficulty": "core",
    "priority": 85,
    "shortType": "concept",
    "definition": "TODO: define CI/CD for data pipelines.",
    "prerequisites": [],
    "relatedConcepts": [],
    "nextConcepts": [],
    "quickPaths": [],
    "tags": [
      "devops"
    ],
    "sourceRefs": [
      {
        "source": "de_encyclopedia_2025.html",
        "section": "Most Asked Concepts · DevOps/IaC",
        "sourceType": "primary"
      }
    ],
    "provenance": "inferred",
    "authoringStatus": "stub"
  },
  {
    "id": "de.devops.docker-multi-stage-builds",
    "schemaVersion": 1,
    "contentVersion": "2026.09.1",
    "type": "concept",
    "domain": "data-engineering",
    "topic": "devops",
    "term": "Docker multi-stage builds",
    "difficulty": "core",
    "priority": 85,
    "shortType": "concept",
    "definition": "TODO: define Docker multi-stage builds.",
    "prerequisites": [],
    "relatedConcepts": [],
    "nextConcepts": [],
    "quickPaths": [],
    "tags": [
      "devops"
    ],
    "sourceRefs": [
      {
        "source": "de_encyclopedia_2025.html",
        "section": "Most Asked Concepts · DevOps/IaC",
        "sourceType": "primary"
      }
    ],
    "provenance": "inferred",
    "authoringStatus": "stub"
  },
  {
    "id": "de.devops.kubernetes-data-operator-patterns",
    "schemaVersion": 1,
    "contentVersion": "2026.09.1",
    "type": "concept",
    "domain": "data-engineering",
    "topic": "devops",
    "term": "Kubernetes data operator patterns",
    "difficulty": "core",
    "priority": 85,
    "shortType": "concept",
    "definition": "TODO: define Kubernetes data operator patterns.",
    "prerequisites": [],
    "relatedConcepts": [],
    "nextConcepts": [],
    "quickPaths": [],
    "tags": [
      "devops"
    ],
    "sourceRefs": [
      {
        "source": "de_encyclopedia_2025.html",
        "section": "Most Asked Concepts · DevOps/IaC",
        "sourceType": "primary"
      }
    ],
    "provenance": "inferred",
    "authoringStatus": "stub"
  },
  {
    "id": "de.devops.blue-green-deployment-for-pipelines",
    "schemaVersion": 1,
    "contentVersion": "2026.09.1",
    "type": "concept",
    "domain": "data-engineering",
    "topic": "devops",
    "term": "blue-green deployment for pipelines",
    "difficulty": "core",
    "priority": 85,
    "shortType": "concept",
    "definition": "TODO: define blue-green deployment for pipelines.",
    "prerequisites": [],
    "relatedConcepts": [],
    "nextConcepts": [],
    "quickPaths": [],
    "tags": [
      "devops"
    ],
    "sourceRefs": [
      {
        "source": "de_encyclopedia_2025.html",
        "section": "Most Asked Concepts · DevOps/IaC",
        "sourceType": "primary"
      }
    ],
    "provenance": "inferred",
    "authoringStatus": "stub"
  },
  {
    "id": "de.devops.docker",
    "schemaVersion": 1,
    "contentVersion": "2026.09.1",
    "type": "concept",
    "domain": "data-engineering",
    "topic": "devops",
    "term": "Docker",
    "difficulty": "intermediate",
    "priority": 65,
    "shortType": "concept",
    "definition": "Container runtime. Dockerfile, docker-compose, multi-stage builds, image layering.",
    "prerequisites": [],
    "relatedConcepts": [],
    "nextConcepts": [],
    "quickPaths": [],
    "tags": [
      "devops"
    ],
    "sourceRefs": [
      {
        "source": "de_encyclopedia_2025.html",
        "section": "Docker",
        "sourceType": "primary"
      }
    ],
    "provenance": "source-derived",
    "authoringStatus": "stub"
  },
  {
    "id": "de.devops.kubernetes",
    "schemaVersion": 1,
    "contentVersion": "2026.09.1",
    "type": "concept",
    "domain": "data-engineering",
    "topic": "devops",
    "term": "Kubernetes (K8s)",
    "difficulty": "advanced",
    "priority": 55,
    "shortType": "concept",
    "definition": "Container orchestration. Pods, deployments, Helm charts, Spark on K8s, Airflow on K8s.",
    "prerequisites": [],
    "relatedConcepts": [],
    "nextConcepts": [],
    "quickPaths": [],
    "tags": [
      "devops"
    ],
    "sourceRefs": [
      {
        "source": "de_encyclopedia_2025.html",
        "section": "Kubernetes (K8s)",
        "sourceType": "primary"
      }
    ],
    "provenance": "source-derived",
    "authoringStatus": "stub"
  },
  {
    "id": "de.devops.github-actions",
    "schemaVersion": 1,
    "contentVersion": "2026.09.1",
    "type": "concept",
    "domain": "data-engineering",
    "topic": "devops",
    "term": "GitHub Actions",
    "difficulty": "advanced",
    "priority": 55,
    "shortType": "concept",
    "definition": "CI/CD automation natively in GitHub. Matrix builds, composite actions, environments.",
    "prerequisites": [],
    "relatedConcepts": [],
    "nextConcepts": [],
    "quickPaths": [],
    "tags": [
      "devops"
    ],
    "sourceRefs": [
      {
        "source": "de_encyclopedia_2025.html",
        "section": "GitHub Actions",
        "sourceType": "primary"
      }
    ],
    "provenance": "source-derived",
    "authoringStatus": "stub"
  },
  {
    "id": "de.devops.terraform",
    "schemaVersion": 1,
    "contentVersion": "2026.09.1",
    "type": "concept",
    "domain": "data-engineering",
    "topic": "devops",
    "term": "Terraform",
    "difficulty": "advanced",
    "priority": 52,
    "shortType": "concept",
    "definition": "Infrastructure as code. Providers, modules, state management, workspaces, remote state.",
    "prerequisites": [],
    "relatedConcepts": [],
    "nextConcepts": [],
    "quickPaths": [],
    "tags": [
      "devops"
    ],
    "sourceRefs": [
      {
        "source": "de_encyclopedia_2025.html",
        "section": "Infrastructure as Code",
        "sourceType": "primary"
      }
    ],
    "provenance": "source-derived",
    "authoringStatus": "stub"
  },
  {
    "id": "de.devops.jenkins",
    "schemaVersion": 1,
    "contentVersion": "2026.09.1",
    "type": "concept",
    "domain": "data-engineering",
    "topic": "devops",
    "term": "Jenkins",
    "difficulty": "advanced",
    "priority": 30,
    "shortType": "concept",
    "definition": "CI/CD automation platform. Pipelines, stages, shared libraries, plugin ecosystem.",
    "prerequisites": [],
    "relatedConcepts": [],
    "nextConcepts": [],
    "quickPaths": [],
    "tags": [
      "devops"
    ],
    "sourceRefs": [
      {
        "source": "de_encyclopedia_2025.html",
        "section": "Jenkins",
        "sourceType": "primary"
      }
    ],
    "provenance": "source-derived",
    "authoringStatus": "stub"
  },
  {
    "id": "de.devops.gitlab-ci-cd",
    "schemaVersion": 1,
    "contentVersion": "2026.09.1",
    "type": "concept",
    "domain": "data-engineering",
    "topic": "devops",
    "term": "GitLab CI/CD",
    "difficulty": "advanced",
    "priority": 28,
    "shortType": "concept",
    "definition": "GitLab's integrated CI/CD pipelines. Runners, artifacts, environments, GitOps.",
    "prerequisites": [],
    "relatedConcepts": [],
    "nextConcepts": [],
    "quickPaths": [],
    "tags": [
      "devops"
    ],
    "sourceRefs": [
      {
        "source": "de_encyclopedia_2025.html",
        "section": "GitLab CI/CD",
        "sourceType": "primary"
      }
    ],
    "provenance": "source-derived",
    "authoringStatus": "stub"
  },
  {
    "id": "de.devops.ansible",
    "schemaVersion": 1,
    "contentVersion": "2026.09.1",
    "type": "concept",
    "domain": "data-engineering",
    "topic": "devops",
    "term": "Ansible",
    "difficulty": "advanced",
    "priority": 15,
    "shortType": "concept",
    "definition": "Configuration management. Playbooks, roles, idempotent tasks, Ansible Tower.",
    "prerequisites": [],
    "relatedConcepts": [],
    "nextConcepts": [],
    "quickPaths": [],
    "tags": [
      "devops"
    ],
    "sourceRefs": [
      {
        "source": "de_encyclopedia_2025.html",
        "section": "Ansible",
        "sourceType": "primary"
      }
    ],
    "provenance": "source-derived",
    "authoringStatus": "stub"
  }
]
