[
  {
    "id": "de.sql.sql",
    "schemaVersion": 1,
    "contentVersion": "2026.09.1",
    "type": "concept",
    "domain": "data-engineering",
    "topic": "sql",
    "term": "SQL (Advanced)",
    "difficulty": "core",
    "priority": 92,
    "shortType": "concept",
    "definition": "Advanced SQL — window functions, CTEs, stored procedures, query optimization",
    "prerequisites": [],
    "relatedConcepts": [],
    "nextConcepts": [],
    "quickPaths": [],
    "tags": [
      "sql"
    ],
    "sourceRefs": [
      {
        "source": "de_encyclopedia_2025.html",
        "section": "SQL (Advanced)",
        "sourceType": "primary"
      }
    ],
    "provenance": "source-derived",
    "authoringStatus": "stub"
  },
  {
    "id": "de.sql.window-functions",
    "schemaVersion": 1,
    "contentVersion": "2026.09.1",
    "type": "concept",
    "domain": "data-engineering",
    "topic": "sql",
    "term": "Window functions",
    "difficulty": "core",
    "priority": 87,
    "shortType": "concept",
    "definition": "TODO: define Window functions.",
    "prerequisites": [],
    "relatedConcepts": [],
    "nextConcepts": [],
    "quickPaths": [],
    "tags": [
      "sql"
    ],
    "sourceRefs": [
      {
        "source": "de_encyclopedia_2025.html",
        "section": "Most Asked Concepts · SQL",
        "sourceType": "primary"
      }
    ],
    "provenance": "inferred",
    "authoringStatus": "stub"
  },
  {
    "id": "de.sql.ctes-vs-subqueries",
    "schemaVersion": 1,
    "contentVersion": "2026.09.1",
    "type": "concept",
    "domain": "data-engineering",
    "topic": "sql",
    "term": "CTEs vs subqueries",
    "difficulty": "core",
    "priority": 87,
    "shortType": "concept",
    "definition": "TODO: define CTEs vs subqueries.",
    "prerequisites": [],
    "relatedConcepts": [],
    "nextConcepts": [],
    "quickPaths": [],
    "tags": [
      "sql"
    ],
    "sourceRefs": [
      {
        "source": "de_encyclopedia_2025.html",
        "section": "Most Asked Concepts · SQL",
        "sourceType": "primary"
      }
    ],
    "provenance": "inferred",
    "authoringStatus": "stub"
  },
  {
    "id": "de.sql.query-optimization",
    "schemaVersion": 1,
    "contentVersion": "2026.09.1",
    "type": "concept",
    "domain": "data-engineering",
    "topic": "sql",
    "term": "query optimization",
    "difficulty": "core",
    "priority": 87,
    "shortType": "concept",
    "definition": "TODO: define query optimization.",
    "prerequisites": [],
    "relatedConcepts": [],
    "nextConcepts": [],
    "quickPaths": [],
    "tags": [
      "sql"
    ],
    "sourceRefs": [
      {
        "source": "de_encyclopedia_2025.html",
        "section": "Most Asked Concepts · SQL",
        "sourceType": "primary"
      }
    ],
    "provenance": "inferred",
    "authoringStatus": "stub"
  },
  {
    "id": "de.sql.index-strategy",
    "schemaVersion": 1,
    "contentVersion": "2026.09.1",
    "type": "concept",
    "domain": "data-engineering",
    "topic": "sql",
    "term": "index strategy",
    "difficulty": "core",
    "priority": 87,
    "shortType": "concept",
    "definition": "TODO: define index strategy.",
    "prerequisites": [],
    "relatedConcepts": [],
    "nextConcepts": [],
    "quickPaths": [],
    "tags": [
      "sql"
    ],
    "sourceRefs": [
      {
        "source": "de_encyclopedia_2025.html",
        "section": "Most Asked Concepts · SQL",
        "sourceType": "primary"
      }
    ],
    "provenance": "inferred",
    "authoringStatus": "stub"
  },
  {
    "id": "de.sql.scd-implementations",
    "schemaVersion": 1,
    "contentVersion": "2026.09.1",
    "type": "concept",
    "domain": "data-engineering",
    "topic": "sql",
    "term": "SCD implementations",
    "difficulty": "core",
    "priority": 87,
    "shortType": "concept",
    "definition": "TODO: define SCD implementations.",
    "prerequisites": [],
    "relatedConcepts": [],
    "nextConcepts": [],
    "quickPaths": [],
    "tags": [
      "sql"
    ],
    "sourceRefs": [
      {
        "source": "de_encyclopedia_2025.html",
        "section": "Most Asked Concepts · SQL",
        "sourceType": "primary"
      }
    ],
    "provenance": "inferred",
    "authoringStatus": "stub"
  },
  {
    "id": "de.sql.scd-type-1-2-3",
    "schemaVersion": 1,
    "contentVersion": "2026.09.1",
    "type": "concept",
    "domain": "data-engineering",
    "topic": "sql",
    "term": "SCD Type 1/2/3",
    "difficulty": "core",
    "priority": 87,
    "shortType": "concept",
    "definition": "TODO: define SCD Type 1/2/3.",
    "prerequisites": [],
    "relatedConcepts": [],
    "nextConcepts": [],
    "quickPaths": [],
    "tags": [
      "sql"
    ],
    "sourceRefs": [
      {
        "source": "de_encyclopedia_2025.html",
        "section": "Most Asked Concepts · Data Modeling",
        "sourceType": "primary"
      }
    ],
    "provenance": "inferred",
    "authoringStatus": "stub"
  },
  {
    "id": "de.sql.pl-sql-stored-procedures",
    "schemaVersion": 1,
    "contentVersion": "2026.09.1",
    "type": "concept",
    "domain": "data-engineering",
    "topic": "sql",
    "term": "PL/SQL / Stored Procedures",
    "difficulty": "advanced",
    "priority": 33,
    "shortType": "concept",
    "definition": "Enterprise DB language — stored procedures, triggers, legacy ETL heavy usage",
    "prerequisites": [],
    "relatedConcepts": [],
    "nextConcepts": [],
    "quickPaths": [],
    "tags": [
      "sql"
    ],
    "sourceRefs": [
      {
        "source": "de_encyclopedia_2025.html",
        "section": "PL/SQL / Stored Procedures",
        "sourceType": "primary"
      }
    ],
    "provenance": "source-derived",
    "authoringStatus": "stub"
  },
  {
    "id": "de.sql.sql-server",
    "schemaVersion": 1,
    "contentVersion": "2026.09.1",
    "type": "concept",
    "domain": "data-engineering",
    "topic": "sql",
    "term": "SQL Server (MS SQL)",
    "difficulty": "advanced",
    "priority": 33,
    "shortType": "concept",
    "definition": "Microsoft RDBMS. SSIS, SSAS, SSRS ecosystem. Strong in enterprise/banking.",
    "prerequisites": [],
    "relatedConcepts": [],
    "nextConcepts": [],
    "quickPaths": [],
    "tags": [
      "sql"
    ],
    "sourceRefs": [
      {
        "source": "de_encyclopedia_2025.html",
        "section": "SQL Server (MS SQL)",
        "sourceType": "primary"
      }
    ],
    "provenance": "source-derived",
    "authoringStatus": "stub"
  }
]
